"Name","Url","DataSource","ExtractedDate","Firm_","TradingName","Phone","Fax","Address","Contact","Position","PostalAddress","Email","Environment_Group","PrequalificationCategories","Letter"
"Habitat Management Services**","https://webapps.vicroads.vic.gov.au/vrne/prequal.nsf/b5fea222939e6f00ca25783e000334ef/cee858fddc30def7ca25750d0011846f?OpenDocument","Cached","2025-09-12 10:42:32","Universal Computer Consultants Pty Ltd","Habitat Management Services","0408 700 096","9719 7480","Po Box 882, Panton Hill, Vic 3759","Mrs Tanya White","Managing Director","""As Above"", &nbsp","tanya.white@habitatmanagement.com.au","Biodiversity: Flora Fauna and Net Gain Assessments (E-TFL)","AND, E-TFL, GAIN, NET, TFL","H"
"Hacer Group**","https://webapps.vicroads.vic.gov.au/vrne/prequal.nsf/b5fea222939e6f00ca25783e000334ef/d5c2c580aeb50a58ca25817f001e0eb8?OpenDocument","Cached","2025-09-12 10:42:33","Hacer Group Pty Ltd","Hacer Group","(03) 9810 6888","(03) 9853 2208","87 High Street, KEW VIC 3101","Mr Dario Marino","Director/Construction Manager","""As Above"", &nbsp","reception@hacer.com.au",,,"H"
"Halcrow Pacific Pty Ltd","https://webapps.vicroads.vic.gov.au/vrne/prequal.nsf/b5fea222939e6f00ca25783e000334ef/240c5eae27e2bd98ca257bb900248dc1?OpenDocument","Cached","2025-09-12 10:42:33","Halcrow Pacific Pty Ltd",,"(03) 8682 3900","(03) 8682 3999","Level 40, 385 Bourke Street, Melbourne, VIC 3000","Mr Ian Chapman","Highways & Bridges Manager, ANZ","GPO Box 1841, Melbourne, VIC 3001&nbsp","ian.chapman@ch2m.com",,"PAM, PRN, PRS, ROAD, SS, STRUCTURES-SIMPLE, TAR, TCA, TMC, TOF, TOS, TPF, TSD, TSM, TTF","H"
"Hamilton Civil &amp; Construction**","https://webapps.vicroads.vic.gov.au/vrne/prequal.nsf/b5fea222939e6f00ca25783e000334ef/614802a37a2c8772ca25866c0020c143?OpenDocument","Cached","2025-09-12 10:42:34","Nigmel Pty Ltd","Hamilton Civil & Construction",,"03 5572 4810","Lot 2, 146 South Boundary Road, HAMILTON VIC 3300","Ms Jess Schulz","Admin/OHS Manager","PO Box 329, HAMILTON VIC 3300&nbsp","office@nigmel.com",,"BW, M1, M2-BW, M2-PW, PW, WORKS-MINOR","H"
"Hamilton Marino Builders Pty Ltd","https://webapps.vicroads.vic.gov.au/vrne/prequal.nsf/b5fea222939e6f00ca25783e000334ef/f7d506536c413b05ca257d0f001d0f51?OpenDocument","Cached","2025-09-12 10:42:35","Hamilton Marino Builders Pty Ltd",,"03 9912 4999",,"70 Trenerry Crescent , ABBOTSFORD VIC 3067","Eliza Davis","HR Manager","""As Above"", &nbsp","elizad@hamiltonmarino.com.au",,,"H"
"Hanlon Industries Pty Ltd","https://webapps.vicroads.vic.gov.au/vrne/prequal.nsf/b5fea222939e6f00ca25783e000334ef/4e6a4893474bd3d7ca2585bb0023642d?OpenDocument","Cached","2025-09-12 10:42:35","Hanlon Industries Pty Ltd",,"1300 202 280","(03) 5278 6655","85 Heales Road, CORIO VIC 3214","Mr Tom Hanlon","Chief Executive Officer","P O Box 405, NORTH GEELONG VIC 3215&nbsp","admin@hanlonindustries.com.au",,"BW, ERECTION-MAJOR, M2-BW, SE, SIGN","H"
"Hansen Partnership Pty Ltd","https://webapps.vicroads.vic.gov.au/vrne/prequal.nsf/b5fea222939e6f00ca25783e000334ef/933e445a8feac00aca256d0a00074be4?OpenDocument","Cached","2025-09-12 10:42:36","Hansen Partnership Pty Ltd",,"(03) 9654 8844","(03) 9654 8088","Level 4,136 Exhibition Street, Melbourne, VIC 3000","Mr Cameron Gentle","Associate","""As Above""&nbsp","cgentle@hansen-online.com.au",,"LAND, PSAD, PSAM, ST, USE","H"
"Harte Civil Vic Pty Ltd","https://webapps.vicroads.vic.gov.au/vrne/prequal.nsf/b5fea222939e6f00ca25783e000334ef/2c0b3edd30b3b561ca258404000126de?OpenDocument","Cached","2025-09-12 10:42:37","Harte Civil Vic Pty Ltd",,"03 9354 0499",,"24 Catherine Street, COBURG NORTH VIC 3058","Mr Andrew Harte","Director","""As Above"", &nbsp","andrew@hartecivil.com.au",,"F002, R1","H"
"Hatch**","https://webapps.vicroads.vic.gov.au/vrne/prequal.nsf/b5fea222939e6f00ca25783e000334ef/61b0960d9de21275ca25807d0014ebab?OpenDocument","Cached","2025-09-12 10:42:37","Hatch Pty Ltd","Hatch",,,"Level 5, 360 Collins Street, MELBOURNE VIC 3000","Dr Javier Silla","Associate","""As Above"", &nbsp","javier.silla@hatch.com",,"CE, CH, COST, CS, DES, DSD, EA, FD, FIR, FVR, GT, GT-DES, GT-GWH, GT-INV, GWH, HC, H-COMPLEX, H-SIMPLE, INV, LAND, M1, ND1, OF, PAM, PE, PNM, PRN, PRS, RISK, RM, RM1, ROAD, RR, SH, SS, ST, STRUCTURES-COMPLEX, STRUCTURES-SIMPLE, TAR, TCA, TLD, TMC, TOF, TOS, TPF, TSD, TSM, TTF, UR, USE, WSRD","H"
"HDR Pty Ltd","https://webapps.vicroads.vic.gov.au/vrne/prequal.nsf/b5fea222939e6f00ca25783e000334ef/7c8ae6b37953490fca25833e0011ea14?OpenDocument","Cached","2025-09-12 10:42:38","HDR Pty Ltd",,"(07) 3258 6000",,"Level 17, 360 Elizabeth Street, MELBOURNE VIC 3000","Mr Mark Fairweather","Managing Director","PO Box 10791, Adelaide Street, BRISBANE QLD &nbsp","BNE.354Tenders@hdrinc.com",,"CH, CS, FD, H-COMPLEX, H-SIMPLE, M1, M2, ND1, ND2, PAM, PRS, RM1, RM2, ROAD, RR, SH, SS, STRUCTURES-COMPLEX, STRUCTURES-SIMPLE, TAR, TOF, TTF, UR, WSRD","H"
"HDS Australia Pty Ltd","https://webapps.vicroads.vic.gov.au/vrne/prequal.nsf/b5fea222939e6f00ca25783e000334ef/48ef20e27b81c9ecca256d0a00074c73?OpenDocument","Cached","2025-09-12 10:42:38","HDS Australia Pty Ltd",,"(03) 9550 1858","(03) 9560 3008","Waverley Business Centre, 21-23 Aristoc Road, GLEN WAVERLEY VIC 3150","Mr Daniel Ahrens","Managing Director","""As Above""&nbsp","dahrens@hdsaustralia.com.au",,"COS, CTM, CTT, DBS, DMR, DSD, PAM, PRL, PRN, PRS, ROAD, RR, TAR, TIME, TOF, TOS, TPF, TSD, TTF, UR","H"
"Healey Infrastructure Pty Ltd","https://webapps.vicroads.vic.gov.au/vrne/prequal.nsf/b5fea222939e6f00ca25783e000334ef/ef25aa9df749cf93ca257b0b007ce738?OpenDocument","Cached","2025-09-12 10:42:39","Healey Infrastructure Pty Ltd",,"03 9702 8489","03 9702 8483","22 Commercial Drive, LYNBROOK VIC 3975","Mr Daniel Healey","Division Manager","PO BOX 239, NARRE WARREN VIC 3805&nbsp","daniel.h@healeyi.com.au",,"F005, R2, STCE, STS1","H"
"Hi-Lux Technical Services Pty Ltd","https://webapps.vicroads.vic.gov.au/vrne/prequal.nsf/b5fea222939e6f00ca25783e000334ef/8a06b0d42d6c70e2ca256d5800020f62?OpenDocument","Cached","2025-09-12 10:42:40","Hi-Lux Technical Services Pty Ltd",,"(03) 9462 4633","(03) 9462 4166","34-36 Chaffey St, THOMASTOWN VIC 3074","Mr Sam Sozio","Director","PO BOX 141 , THOMASTOWN VIC 3074&nbsp","sales@hlts.com.au",,"OF, ON, ON-ROAD, ROAD, SCTV, SOED, SSLC, STCE, STS, STS1, STS2","H"
"Hickmans Pty Ltd","https://webapps.vicroads.vic.gov.au/vrne/prequal.nsf/b5fea222939e6f00ca25783e000334ef/32b5194c2407ba08ca257b500024b50f?OpenDocument","Cached","2025-09-12 10:42:40","Hickmans Pty Ltd",,"(03) 5447 2944","(03) 5447 2942","434 Olympic Parade, MAIDEN GULLY VIC 3551","Mr Darren Hickman","Director","PO Box 1750, KANGAROO FLAT VIC 3555&nbsp","darren@hickmans.com.au",,,"H"
"Hickory Group Pty Ltd","https://webapps.vicroads.vic.gov.au/vrne/prequal.nsf/b5fea222939e6f00ca25783e000334ef/0fc5f8ec10b0bc10ca257d7b001ef18a?OpenDocument","Cached","2025-09-12 10:42:41","Hickory Group Pty Ltd",,"(03) 9429 7411","(03) 9428 7376","Level 5 68 Clarke Street, SOUTHBANK VIC 3006","Mr Anthony Critelli","HSE Manager","""As Above"", &nbsp","a.critelli@hickory.com.au",,,"H"
"High Access Cabling Pty Ltd","https://webapps.vicroads.vic.gov.au/vrne/prequal.nsf/b5fea222939e6f00ca25783e000334ef/a09d8f5ac7e7f741ca257ec80082fea2?OpenDocument","Cached","2025-09-12 10:42:42","High Access Cabling Pty Ltd",,"(03) 9850 5111","(03) 9850 5611","18 Greenaway Street, BULLEEN VIC 3105","Mr John Newton","Director","P O Box 491, BULLEEN VIC 3105&nbsp","info@highaccessgroup.com.au",,"SCTV, SSLC, STCE","H"
"Hird Constructions Pty Ltd","https://webapps.vicroads.vic.gov.au/vrne/prequal.nsf/b5fea222939e6f00ca25783e000334ef/0f726e00c9b65b6fca257b250012ee61?OpenDocument","Cached","2025-09-12 10:42:42","Hird Constructions Pty Ltd",,,"(03) 5447 3139","29 Coonooer Street, Kangaroo Flat VIC 3555","Mr Lindsay Hird","Managet/ Director","P O Box 3022, Bendigo VIC 3554&nbsp","hirdcon1@bigpond.com",,,"H"
"Hiway Aus Pty Ltd","https://webapps.vicroads.vic.gov.au/vrne/prequal.nsf/b5fea222939e6f00ca25783e000334ef/42ba799e15a9f8cbca258bbe00092b1b?OpenDocument","Cached","2025-09-12 10:42:43","Hiway Aus Pty Ltd",,"07 5541 2074",,"503 Sandy Creek Road, JOSEPHVILLE, QLD 4285","Mr Andrew Thwaites","General Manager Victoria","PO Box 3500, LOGANHOLME QLD 4129&nbsp","andrew.thwaites@highway.au",,"F050, R2","H"
"HMI Technologies Pty Ltd","https://webapps.vicroads.vic.gov.au/vrne/prequal.nsf/b5fea222939e6f00ca25783e000334ef/e6cb04692ab39b0eca257b2e0070cfc1?OpenDocument","Cached","2025-09-12 10:42:43","HMI Technologies Pty Ltd",,"+61 (03) 9077 9005",,"13 Silicon Drive, Tullamarine VIC 3043","Mr Dean Zabrieszach","CEO/Director","P O Box 1063, Tullamarine VIC 3043&nbsp","dean.zabrieszach@hmitechnologies.com.au",,"OF, ON, ON-ROAD, ROAD, SOED","H"
"Hoare Bros Pty Ltd","https://webapps.vicroads.vic.gov.au/vrne/prequal.nsf/b5fea222939e6f00ca25783e000334ef/444cb3ad6388babaca25729d0023043e?OpenDocument","Cached","2025-09-12 10:42:44","Hoare Bros Pty Ltd",,"(03) 5221 2100","(03) 5221 2007","99 Barwon Terrace, SOUTH GEELONG VIC 3220","Mr Deryck Gall","Office Manager","PO BOX 830, GEELONG VIC 3220&nbsp","hoarebros@bigpond.com.au",,"M1, WORKS-MINOR","H"
"Horsham Rural City Council","https://webapps.vicroads.vic.gov.au/vrne/prequal.nsf/b5fea222939e6f00ca25783e000334ef/18736622126cc2d0ca257a15001f02e1?OpenDocument","Cached","2025-09-12 10:42:45","Horsham Rural City Council",,"(03) 5382 9777","(03) 5382 1111","Roberts Avenue, Horsham VIC 3400","Mr Martin Duke","Operations Engineer","P.O. Box 511, Horsham VIC 3402&nbsp","council@hrcc.vic.gov.au",,,"H"
"Hourigan &amp; Walsh Pty Ltd","https://webapps.vicroads.vic.gov.au/vrne/prequal.nsf/b5fea222939e6f00ca25783e000334ef/5f7cc69b314be209ca25707500191241?OpenDocument","Cached","2025-09-12 10:42:45","Hourigan & Walsh Pty Ltd",,"(03) 5174 1378","(03) 5174 0737","Lot 6 Alamere Drive, TRARALGON VIC 3844","Mr Peter Hourigan","Director","PO Box 1480, TRARALGON VIC 3844&nbsp","peter.hourigan1@bigpond.com.au",,"B2, F001","H"
"Hume Contracting Pty Ltd","https://webapps.vicroads.vic.gov.au/vrne/prequal.nsf/b5fea222939e6f00ca25783e000334ef/aa16eb2bdd8dcfb8ca2577c20022c63e?OpenDocument","Cached","2025-09-12 10:42:46","Hume Contracting Pty Ltd",,"03 9744 3033","03 9744 2976","275 Lancefield Road, SUNBURY VIC 3429","Mr Michael Van Vlaandoren","Manager","PO Box 899, SUNBURY VIC 3429&nbsp","humecontracting@bigpond.com",,"GC, M2-RW, RW","H"
"Hutchinson Civil Pty Ltd","https://webapps.vicroads.vic.gov.au/vrne/prequal.nsf/b5fea222939e6f00ca25783e000334ef/407929bd8d0d8a08ca25845a0074358d?OpenDocument","Cached","2025-09-12 10:42:47","Hutchinson Civil Pty Ltd",,,,"52 Conrad Place, LAVINGTON NSW 2641","Mr Bede Hutchinson","Director","""As Above"", &nbsp","bede@hutchinsoncivil.com.au",,"F015, R1","H"
"Huxley Road Services Pty Ltd","https://webapps.vicroads.vic.gov.au/vrne/prequal.nsf/b5fea222939e6f00ca25783e000334ef/831178a09d522a72ca258434001c1458?OpenDocument","Cached","2025-09-12 10:42:47","Huxley Road Services Pty Ltd",,,,"21 Aster Avenue, CARRUM DOWNS VIC 3201","Mr Wayne Huxley","Director","""As Above"", &nbsp","Wayne@huxleyroadservices.com.au",,"GC, M1, WORKS-MINOR","H"
