"Name","Url","DataSource","ExtractedDate","Firm_","Trading_Name_","Address","Postal_Address_","Mobile_No_","Email","Maintenance_and_General_Works__Group","General_Works","PrequalificationCategories","Letter"
"S &amp; L Maintenance Pty Ltd","https://webapps.vicroads.vic.gov.au/vrne/prequal.nsf/b5fea222939e6f00ca25783e000334ef/10f3add6fa5d24a7ca2581410007ecd5?OpenDocument","Fresh","2025-09-12 10:45:48","S & L Maintenance Pty Ltd&nbsp","&nbsp","167 -181 Old Melbourne RoadLITTLE RIVER  VIC   3211&nbsp","PO BOX 131LITTLE RIVER  VIC 3211&nbsp","0425 863 951&nbsp","[email&#160;protected] &nbsp","Categories: Categories:, Categories:, Maintenance Bridges (M2-BW), Maintenance Works-Minor (M1)","General Works-Minor (G1), Sign Erection-Major (G2-SE)","Categories: M1, M2-BW, screen, script, scripts, SE, Section, Service, Sign, size, src, static, strong, Stuart, style, supplierdetails","S"
"S &amp; N Road Stabilising Pty Ltd","https://webapps.vicroads.vic.gov.au/vrne/prequal.nsf/b5fea222939e6f00ca25783e000334ef/2410c8d6ebcb0910ca25849d00759033?OpenDocument","Fresh","2025-09-12 10:45:48","S & N Road Stabilising Pty Ltd&nbsp","&nbsp","7718 Midland HighwayMAGPIE  VIC   3352&nbsp","&quot;As Above&quot; &nbsp","0429 894 467&nbsp","[email&#160;protected]&nbsp","Categories: Categories:, Categories:, Maintenance Pavements (M2-PW), Maintenance Works-Minor (M1)","General Works-Minor (G1)","Categories: M1, M2-PW, Sam, screen, script, scripts, Section, Service, size, src, Stabilising, static, strong, style, supplierdetails","S"
"S &amp; R Engineering and Construction Pty Ltd","https://webapps.vicroads.vic.gov.au/vrne/prequal.nsf/b5fea222939e6f00ca25783e000334ef/57e195092674cf8fca258ae6001959bc?OpenDocument","Fresh","2025-09-12 10:45:49","S & R Engineering and Construction Pty Ltd&nbsp","&nbsp","228 Marong Rd Maiden Gully VIC   3551&nbsp","&quot;As Above&quot; &nbsp","0439 427 129&nbsp","[email&#160;protected]&nbsp",,,"Categories: F015, R1, screen, script, scripts, Section, Service, size, src, static, strong, style, supplierdetails","S"
"S &amp; Z Australia Pty Ltd","https://webapps.vicroads.vic.gov.au/vrne/prequal.nsf/b5fea222939e6f00ca25783e000334ef/fca6fa7a5aebdaf3ca25848e007fddd0?OpenDocument","Fresh","2025-09-12 10:45:50","S & Z Australia Pty Ltd&nbsp","&nbsp","18 Logistics StreetKEILOR PARK  VIC   3042&nbsp","PO Box 141 NORTH ESSENDON  VIC 3041&nbsp","&nbsp","[email&#160;protected]&nbsp","Categories: Categories:, Categories:","General Works-Minor (G1)","Categories: screen, script, scripts, Section, Service, size, src, static, Street, strong, style, supplierdetails","S"
"Safe Civil Solutions**","https://webapps.vicroads.vic.gov.au/vrne/prequal.nsf/b5fea222939e6f00ca25783e000334ef/3e2a2b20bd7af988ca258067001a3b44?OpenDocument","Fresh","2025-09-12 10:45:50","Payne Pit Installations Pty Ltd&nbsp","Safe Civil Solutions&nbsp","310 A'Beckett RoadBUNYIP  VIC   3815&nbsp","&quot;As Above&quot; &nbsp","0438 298 561&nbsp","[email&#160;protected]&nbsp",,,"Categories: Safe, screen, script, scripts, Section, see, Service, Services, size, Solutions, src, static, strong, style, superseded, supplierdetails","S"
"Safe System Solutions Pty Ltd","https://webapps.vicroads.vic.gov.au/vrne/prequal.nsf/b5fea222939e6f00ca25783e000334ef/8a9b918bf141a854ca257c58001276b9?OpenDocument","Fresh","2025-09-12 10:45:51","Safe System Solutions Pty Ltd&nbsp","&nbsp","Office G2 10-14 Hope StreetBRUNSWICK  VIC   3056&nbsp","&quot;As Above&quot; &nbsp","0401 345 461&nbsp","[email&#160;protected]&nbsp",,,"Categories: Safe, Safety, screen, script, scripts, Section, Service, Services, Signal, Signing, size, Solutions, Specialist, Specialists, src, static, Strategies, Strategy, Street, strong, Studies, style, supplierdetails, System","S"
"Safer Roads Traffic Management Australia Pty Ltd","https://webapps.vicroads.vic.gov.au/vrne/prequal.nsf/b5fea222939e6f00ca25783e000334ef/fb85f9de2e710a5dca25812b0003783f?OpenDocument","Fresh","2025-09-12 10:45:52","Safer Roads Traffic Management Australia Pty Ltd&nbsp","&nbsp","44 Wehlow StreetMT DRUITT  NSW   2770&nbsp","&quot;As Above&quot; &nbsp","0403 530 633&nbsp","[email&#160;protected]&nbsp",,,"Categories: Safer, screen, script, scripts, Secretary, Section, see, Service, Services, size, src, static, Street, strong, style, superseded, supplierdetails","S"
"Saferoads Pty Ltd","https://webapps.vicroads.vic.gov.au/vrne/prequal.nsf/b5fea222939e6f00ca25783e000334ef/6710d27887a9c174ca256d67001f94cd?OpenDocument","Fresh","2025-09-12 10:45:52","Saferoads Pty Ltd&nbsp","&nbsp","22 Commercial DrivePAKENHAM 3810   3810&nbsp","PO Box  2030PAKENHAM  VIC 3810&nbsp","0419 512 850&nbsp","[email&#160;protected]&nbsp","Categories: Categories:, Categories:","Guardfence (G2-GF)","Categories: Saferoads, screen, script, scripts, Section, Service, size, src, static, strong, style, supplierdetails","S"
"Safety Barrier Solutions Pty Ltd","https://webapps.vicroads.vic.gov.au/vrne/prequal.nsf/b5fea222939e6f00ca25783e000334ef/49271481836fd551ca2579bb00205342?OpenDocument","Fresh","2025-09-12 10:45:53","Safety Barrier Solutions Pty Ltd&nbsp","&nbsp","61 National DrivePAKENHAM  VIC   3810&nbsp","&quot;As Above&quot;&nbsp","&nbsp","[email&#160;protected]&nbsp","Categories: Categories:, Categories:","Guardfence (G2-GF)","Categories: Safety, screen, script, scripts, Section, Service, Shane, size, Solutions, src, static, strong, style, supplierdetails","S"
"SAGE Automation**","https://webapps.vicroads.vic.gov.au/vrne/prequal.nsf/b5fea222939e6f00ca25783e000334ef/068ab3f774eebf66ca2579ac00048751?OpenDocument","Fresh","2025-09-12 10:45:53","SAGE Automation Pty Ltd&nbsp","SAGE Automation&nbsp","Level 21, HWT Tower, 40 City RoadSouthbank VIC   3006&nbsp","As above &nbsp","0419 030 561&nbsp","[email&#160;protected]&nbsp",,,"Categories: SAGE, screen, script, scripts, SCTV, Section, Service, Services, size, SOED, Southbank, src, SSLC, static, STCE, Street, strong, style, supplierdetails, Supply, Systems","S"
"SALT3**","https://webapps.vicroads.vic.gov.au/vrne/prequal.nsf/b5fea222939e6f00ca25783e000334ef/eeb0b86ae689e515ca257e6700031e74?OpenDocument","Fresh","2025-09-12 10:45:54","Sustainable Transport Surveys Pty Ltd atf ST Surveys Unit Trust&nbsp","SALT3&nbsp","Level 6, 360 Collins StreetMELBOURNE  VIC   3000&nbsp","&quot;As Above&quot; &nbsp","&nbsp","[email&#160;protected]&nbsp",,,"Categories: Safety, SALT3, screen, script, scripts, Section, Service, Services, Signal, Signing, Simulation, size, src, ST, static, Strategies, Street, strong, style, supplierdetails, Survey, Surveys, Sustainable","S"
"Samsung C&amp;T Corporation","https://webapps.vicroads.vic.gov.au/vrne/prequal.nsf/b5fea222939e6f00ca25783e000334ef/825dfc2cf928004bca258861001482ac?OpenDocument","Fresh","2025-09-12 10:45:55","Samsung C&T Corporation&nbsp","&nbsp","Level 2, 44 Market StreetSYDNEY   NSW   2000&nbsp","&quot;As Above&quot; &nbsp","0488 480 122&nbsp","[email&#160;protected] &nbsp",,,"Categories: B4, F150, R5, Samsung, screen, script, scripts, Section, Service, size, src, static, Street, strong, style, supplierdetails, SYDNEY","S"
"Sandridge Roads Pty Ltd","https://webapps.vicroads.vic.gov.au/vrne/prequal.nsf/b5fea222939e6f00ca25783e000334ef/f0b84cdbdabc5fafca256d6d001b941d?OpenDocument","Fresh","2025-09-12 10:45:55","Sandridge Roads Pty Ltd&nbsp","&nbsp","410 Tooradin Station RoadDALMORE  VIC   3981&nbsp","P O Box 69TOORADIN  VIC 3980&nbsp","0407 862 065&nbsp","[email&#160;protected]&nbsp",,,"Categories: F025, R2, Sandridge, Saunders, screen, script, scripts, Section, Service, size, src, static, Station, strong, style, supplierdetails","S"
"Sands Civil Group Pty Ltd","https://webapps.vicroads.vic.gov.au/vrne/prequal.nsf/b5fea222939e6f00ca25783e000334ef/7e5447a7fc959864ca257f7d0000eaf9?OpenDocument","Fresh","2025-09-12 10:45:56","Sands Civil Group Pty Ltd&nbsp","&nbsp","Unit 3 Guelph StreetSOMERVILLE  VIC   3912&nbsp","P O Box 916SOMERVILLE  VIC 3912&nbsp","0403 594 846&nbsp","[email&#160;protected] &nbsp",,,"Categories: Sagar, Sands, screen, script, scripts, Section, see, Service, Services, size, SOMERVILLE, src, static, Street, strong, style, superseded, supplierdetails","S"
"Seed Engineering Pty Ltd","https://webapps.vicroads.vic.gov.au/vrne/prequal.nsf/b5fea222939e6f00ca25783e000334ef/f822166feda9265bca25814c001dba21?OpenDocument","Fresh","2025-09-12 10:45:57","Seed Engineering Pty Ltd&nbsp","&nbsp","Suite 6.09, 55 Miller StreetPYRMONT  NSW   2009&nbsp","&quot;As Above&quot; &nbsp","0407 205 709&nbsp","[email&#160;protected]&nbsp",,,"Categories: Safety, screen, script, scripts, Section, Seed, Service, Services, Signal, size, src, static, Strategies, Street, strong, style, Suite, supplierdetails","S"
"Senversa Pty Ltd","https://webapps.vicroads.vic.gov.au/vrne/prequal.nsf/b5fea222939e6f00ca25783e000334ef/8a5bbf1208244bb7ca2577b6001ec2fd?OpenDocument","Fresh","2025-09-12 10:45:57","Senversa Pty Ltd&nbsp","&nbsp","Level 6, 15 William StreetMELBOURNE  VIC   3000&nbsp","&quot;As Above&quot; &nbsp","+61 499 771 822&nbsp","[email&#160;protected]&nbsp",,,"Categories: screen, script, scripts, Section, Senversa, Service, Services, size, src, static, Street, strong, style, supplierdetails","S"
"Service Stream Maintenance Pty Ltd","https://webapps.vicroads.vic.gov.au/vrne/prequal.nsf/b5fea222939e6f00ca25783e000334ef/84cbf3d1a12ffb2bca25876c001790a2?OpenDocument","Fresh","2025-09-12 10:45:58","Service Stream Maintenance Pty Ltd&nbsp","&nbsp","Level 5, 655 Collins StreetDOCKLANDS VIC   3008&nbsp","&quot;As Above&quot; &nbsp","0478 740 290&nbsp","[email&#160;protected]&nbsp","Categories: Categories:, Categories:, Maintenance Bridges (M2-BW), Maintenance Pavements (M2-PW), Maintenance Roadsides (M2-RW)",,"Categories: B1, F150, M2-BW, M2-PW, M2-RW, R2, screen, script, scripts, SCTV, Section, see, Service, Services, size, src, SSLC, static, STCE, Strategy, Stream, Street, strong, style, superseded, supplierdetails, Supply, Systems","S"
"Seven Creeks Excavations Pty Ltd","https://webapps.vicroads.vic.gov.au/vrne/prequal.nsf/b5fea222939e6f00ca25783e000334ef/c4d77e4767cead90ca2584f70016f121?OpenDocument","Fresh","2025-09-12 10:45:58","Seven Creeks Excavations Pty Ltd&nbsp","&nbsp","7-9 Garrett StreetEUROA  VIC   3666&nbsp","PO BOX 28EUROA  VIC 3666&nbsp","0418 297 990&nbsp","[email&#160;protected]&nbsp",,,"Categories: B1, F005, R1, screen, script, scripts, Section, Service, Seven, size, src, static, Street, strong, style, supplierdetails","S"
"Seymour Whyte Constructions Pty Ltd","https://webapps.vicroads.vic.gov.au/vrne/prequal.nsf/b5fea222939e6f00ca25783e000334ef/e0ce1c460075791dca257e2d00193c5f?OpenDocument","Fresh","2025-09-12 10:45:59","Seymour Whyte Constructions Pty Ltd&nbsp","&nbsp","Suite 3.04 Level 3 11 Queens RoadMELBOURNE  VIC   3004&nbsp","PO Box 4436EIGHT MILE PLAINS  QLD  4113&nbsp","0458 070 266&nbsp","[email&#160;protected]   &nbsp",,,"Categories: B4, F150, R5, screen, script, scripts, Section, Senior, Service, Seymour, size, src, static, strong, style, Suite, supplierdetails","S"
"SGS Australia Traffic Systems**","https://webapps.vicroads.vic.gov.au/vrne/prequal.nsf/b5fea222939e6f00ca25783e000334ef/01c6675bd1052521ca256e62000721af?OpenDocument","Fresh","2025-09-12 10:46:00","SGS Australia Pty Ltd&nbsp","SGS Australia Traffic Systems&nbsp","10 / 585 Blackburn RoadNOTTING HILL  VIC   3168&nbsp","PO Box 32 WELSHPOOL   WA 6105&nbsp","0436 940 741&nbsp","[email&#160;protected]&nbsp",,,"Categories: Safety, screen, script, scripts, Section, Service, Services, SGS, size, src, static, Strategies, strong, style, supplierdetails, Systems","S"
"Shamrock Civil Engineering Pty Ltd","https://webapps.vicroads.vic.gov.au/vrne/prequal.nsf/b5fea222939e6f00ca25783e000334ef/b09883db8ed635fbca2582890005a240?OpenDocument","Fresh","2025-09-12 10:46:00","Shamrock Civil Engineering Pty Ltd&nbsp","&nbsp","195 Cobalt StreetCAROLE PARK  QLD   4300&nbsp","P O Box 207CAROLE PARK  QLD 4300&nbsp","0499 029 518&nbsp","[email&#160;protected][email&#160;protected]&nbsp",,,"Categories: B2, F075, R3, screen, script, scripts, Section, Service, Shamrock, size, src, static, Street, strong, style, supplierdetails","S"
"Shenoc Pty Ltd","https://webapps.vicroads.vic.gov.au/vrne/prequal.nsf/b5fea222939e6f00ca25783e000334ef/9d734812b77d8a58ca257738001fac63?OpenDocument","Fresh","2025-09-12 10:46:01","Shenoc Pty Ltd&nbsp","&nbsp","55 Sharps & Taylors RoadTALLAROOK  VIC   3659&nbsp","&quot;As Above&quot; &nbsp","0417 567 667&nbsp","[email&#160;protected]&nbsp","Categories: Categories:, Categories:","Grass Cutting (G2-GC)","Categories: screen, script, scripts, Section, Service, Sharps, Shenoc, size, src, static, strong, style, supplierdetails","S"
"SHS Civil **","https://webapps.vicroads.vic.gov.au/vrne/prequal.nsf/b5fea222939e6f00ca25783e000334ef/ebdf0ae65543e7a6ca2575bb007e6ad4?OpenDocument","Fresh","2025-09-12 10:46:02","S T Hamilton & Sons Construction Pty Ltd&nbsp","SHS Civil &nbsp","72 Port Fairy RoadARARAT  VIC   3377&nbsp","&quot;As Above&quot;&nbsp","0407 814 336&nbsp","[email&#160;protected]&nbsp","Categories: Categories:, Categories:, Maintenance Bridges (M2-BW), Maintenance Pavements (M2-PW), Maintenance Roadsides (M2-RW), Maintenance Works-Minor (M1)","Grass Cutting (G2-GC), Road Surfacing Sprayed Seal (G2-RSS)","Categories: B1, F001, M1, M2-BW, M2-PW, M2-RW, R2, screen, script, scripts, Seal, sealing, Section, Service, SHS, size, Sons, sprayed, Sprayed, src, static, strong, style, supplierdetails, surfacing, Surfacing","S"
"SICE Pty Ltd","https://webapps.vicroads.vic.gov.au/vrne/prequal.nsf/b5fea222939e6f00ca25783e000334ef/e73009b7121c6071ca2583eb000b5e3d?OpenDocument","Fresh","2025-09-12 10:46:02","SICE Pty Ltd&nbsp","&nbsp","200 Carlisle St.,ST KILDA   VIC   3182&nbsp","&quot;As Above&quot; &nbsp","(+61) 472 507 300&nbsp","[email&#160;protected]&nbsp",,,"Categories: screen, script, scripts, Section, Service, Services, SICE, size, src, St, ST, static, strong, style, supplierdetails, Systems","S"
"Sidra Solutions**","https://webapps.vicroads.vic.gov.au/vrne/prequal.nsf/b5fea222939e6f00ca25783e000334ef/1f819780bce47de4ca256d0a000735b8?OpenDocument","Fresh","2025-09-12 10:46:03","Akcelik & Associates Pty Ltd&nbsp","Sidra Solutions&nbsp","Suite 1, 291 Doncaster RoadBALWYN NORTH  VIC   3104&nbsp","PO BOX 1075GGREYTHORN VIC 3104&nbsp","0419 755 954&nbsp","[email&#160;protected]&nbsp",,,"Categories: screen, script, scripts, Section, Service, Services, Sevim, Sidra, Signal, Simulation, size, Solutions, src, static, strong, style, Suite, supplierdetails, Survey, surveys, Systems","S"
"Signs Traffic Management Pty Ltd","https://webapps.vicroads.vic.gov.au/vrne/prequal.nsf/b5fea222939e6f00ca25783e000334ef/ea9da8ed451930dfca2587ad0013fac4?OpenDocument","Fresh","2025-09-12 10:46:04","Signs Traffic Management Pty Ltd&nbsp","&nbsp","37 Denbeigh  CloseMOOLAP  VIC   3224&nbsp","&quot;As Above&quot; &nbsp","0421 754 566&nbsp","[email&#160;protected]&nbsp",,,"Categories: screen, script, scripts, Section, see, Service, Services, Signs, size, src, static, strong, style, superseded, supplierdetails","S"
"Silman Bros Asphalting Pty Ltd","https://webapps.vicroads.vic.gov.au/vrne/prequal.nsf/b5fea222939e6f00ca25783e000334ef/2e85dec519a5d6acca257ec1001edf2e?OpenDocument","Fresh","2025-09-12 10:46:04","Silman Bros Asphalting Pty Ltd&nbsp","&nbsp","42 Yellowbox DriveCRAIGIEBURN  VIC   3064&nbsp","&quot;As Above&quot; &nbsp","0430 773 169&nbsp","[email&#160;protected]&nbsp","Categories: Categories:, Categories:, Maintenance Pavements (M2-PW), Maintenance Works-Minor (M1)",,"Categories: M1, M2-PW, screen, script, scripts, Section, Service, Silman, size, src, static, strong, style, supplierdetails","S"
"Silverstrand Developments Pty Ltd","https://webapps.vicroads.vic.gov.au/vrne/prequal.nsf/b5fea222939e6f00ca25783e000334ef/3f6c72551c27b40fca25868e007fc284?OpenDocument","Fresh","2025-09-12 10:46:05","Silverstrand Developments Pty Ltd&nbsp","&nbsp","Unit 5/41 Paringa RdMURARRIE, QLD   4172&nbsp","&quot;As Above&quot; &nbsp","0412 149 708&nbsp","[email&#160;protected][email&#160;protected]&nbsp",,,"Categories: B2, F010, R2, screen, script, scripts, Section, Senior, Service, Silverstrand, size, src, static, strong, style, supplierdetails","S"
"Simpson Construction Company Pty Ltd","https://webapps.vicroads.vic.gov.au/vrne/prequal.nsf/b5fea222939e6f00ca25783e000334ef/30c7c8cbb8765571ca256d0b00171c49?OpenDocument","Fresh","2025-09-12 10:46:05","Simpson Construction Company Pty Ltd&nbsp","&nbsp","4 Duffy StreetBURWOOD  VIC   3125&nbsp","&quot;As Above&quot;&nbsp","&nbsp","[email&#160;protected]&nbsp",,,"Categories: B3, F010, R2, screen, script, scripts, Section, Service, Simpson, size, src, static, Street, strong, style, supplierdetails","S"
"Site Geotechnical Pty Ltd","https://webapps.vicroads.vic.gov.au/vrne/prequal.nsf/b5fea222939e6f00ca25783e000334ef/96bd1d4416a839f3ca25794b007bf38f?OpenDocument","Fresh","2025-09-12 10:46:06","Site Geotechnical Pty Ltd&nbsp","&nbsp","4/8 Cannery CourtTYABB VIC   3913&nbsp","&quot;As Above&quot; &nbsp","0434 268 660&nbsp","[email&#160;protected]&nbsp",,,"Categories: screen, script, scripts, Section, Service, Site, size, Specialists, src, Stace, static, strong, style, supplierdetails","S"
"Sitec Pty Ltd","https://webapps.vicroads.vic.gov.au/vrne/prequal.nsf/b5fea222939e6f00ca25783e000334ef/aac446e516e46d75ca258518008196aa?OpenDocument","Fresh","2025-09-12 10:46:07","Sitec Pty Ltd&nbsp","&nbsp","184 Fairy StreetWARRNAMBOOL  VIC   3280&nbsp","&quot;As Above&quot; &nbsp","0427 629 661&nbsp","[email&#160;protected] [email&#160;protected]&nbsp",,,"Categories: Safety, screen, script, scripts, Section, Service, Services, Sitec, size, src, static, Street, strong, Stuart, style, supplierdetails","S"
"SJE Consulting Pty Ltd","https://webapps.vicroads.vic.gov.au/vrne/prequal.nsf/b5fea222939e6f00ca25783e000334ef/9d348ed4a2d06d8eca2589b2000b37ab?OpenDocument","Fresh","2025-09-12 10:46:07","SJE Consulting Pty Ltd&nbsp","&nbsp","613 Plenty RoadPRESTON  VIC   3072&nbsp","391 Townsend StreetALBURY  NSW &nbsp","0439 112 515&nbsp","[email&#160;protected]&nbsp",,,"Categories: safety, screen, script, scripts, Section, Senior, Service, SH, Simple, size, SJE, src, static, Street, strong, style, subject, supplierdetails","S"
"SJP Electrics Pty Ltd","https://webapps.vicroads.vic.gov.au/vrne/prequal.nsf/b5fea222939e6f00ca25783e000334ef/3531b41a9e5fad54ca25792f007ec357?OpenDocument","Fresh","2025-09-12 10:46:08","SJP Electrics Pty Ltd&nbsp","&nbsp","6 Sir Leo Curtis DriveWANDONG   3758&nbsp","P O Box 296Whittlesea  VIC 3757&nbsp","0417 571 002&nbsp","[email&#160;protected]&nbsp",,,"Categories: screen, script, scripts, Section, see, Service, Services, Signals, Sir, size, SJP, src, SSLC, static, STCE, Street, strong, STS, STS1, STS2, Stuart, style, superseded, supplierdetails, Supply, Systems","S"
"Slattery Australia Pty Ltd","https://webapps.vicroads.vic.gov.au/vrne/prequal.nsf/b5fea222939e6f00ca25783e000334ef/99d846e7f9f7affbca257c590002f103?OpenDocument","Fresh","2025-09-12 10:46:09","Slattery Australia Pty Ltd&nbsp","&nbsp","Level 14, 160 Queen StreetMelbourne, VIC   3000&nbsp","&quot;As Above&quot; &nbsp","&nbsp","[email&#160;protected]&nbsp",,,"Categories: Sarah, screen, script, scripts, Section, Service, size, Slattery, Specialist, src, static, Street, strong, Studies, style, supplierdetails","S"
"Slingo Earthmoving Pty Ltd","https://webapps.vicroads.vic.gov.au/vrne/prequal.nsf/b5fea222939e6f00ca25783e000334ef/9423b6222ce090a4ca257cdd0006a966?OpenDocument","Fresh","2025-09-12 10:46:09","Slingo Earthmoving Pty Ltd&nbsp","&nbsp","Lot 28A McKenzies HillCastlemaine  VIC   3450&nbsp","PO Box 1250Castlemaine  VIC 3450&nbsp","0417 032 621&nbsp","[email&#160;protected]&nbsp",,,"Categories: B1, F010, R2, screen, script, scripts, Section, Service, size, Slingo, src, static, strong, style, supplierdetails","S"
"SLR Consulting Group (Previously Heggies Pty Ltd)","https://webapps.vicroads.vic.gov.au/vrne/prequal.nsf/b5fea222939e6f00ca25783e000334ef/a215f34875b6c32fca256d0a00075dd9?OpenDocument","Fresh","2025-09-12 10:46:10","SLR Consulting Group (Previously Heggies Pty Ltd)&nbsp","&nbsp","Suite 2 / 2 Domville AvenueHAWTHORN  VIC   3122&nbsp","&quot;As Above&quot;&nbsp","0412 052 622&nbsp","[email&#160;protected] &nbsp",,,"Categories: screen, script, scripts, Section, Service, size, SLR, src, static, strong, style, Suite, supplierdetails","S"
"SMEC Australia Pty Ltd","https://webapps.vicroads.vic.gov.au/vrne/prequal.nsf/b5fea222939e6f00ca25783e000334ef/caadd87cc0a014c9ca256d0a0007612c?OpenDocument","Fresh","2025-09-12 10:46:10","SMEC Australia Pty Ltd&nbsp","&nbsp","Collins Square, Tower 4,727 Collins StreetMELBOURNE  VIC    3008&nbsp","PO Box  23027DOCKLANDS VIC 8012&nbsp","0403 052 785&nbsp","[email&#160;protected]&nbsp",,,"Categories: Safety, Scheme, screen, script, scripts, Section, Senior, Sensitive, Service, Services, SH, Signal, Signing, Simple, Simulation, size, SMEC, Specialist, Specialists, Square, src, SRSA, SS, ST, static, Strategic, Strategies, Strategy, Street, strong, Structures, Studies, Study, style, Styles, supplierdetails, Survey, surveys, Systems","S"
"Smith &amp; Wil Asphalting Pty Ltd","https://webapps.vicroads.vic.gov.au/vrne/prequal.nsf/b5fea222939e6f00ca25783e000334ef/e53ea4e12d031534ca257d7e001fbe86?OpenDocument","Fresh","2025-09-12 10:46:11","Smith & Wil Asphalting Pty Ltd&nbsp","&nbsp","46 Giles RoadMOUNT ROWAN   VIC   3352&nbsp","&quot;As Above&quot; &nbsp","0427 327 658&nbsp","[email&#160;protected]&nbsp","Categories: Categories:, Categories:, Maintenance Pavements (M2-PW)",,"Categories: M2-PW, screen, script, scripts, Section, Service, size, Smith, Smithson, src, static, strong, style, supplierdetails","S"
"South Gippsland Shire Council","https://webapps.vicroads.vic.gov.au/vrne/prequal.nsf/b5fea222939e6f00ca25783e000334ef/de5be431fa48334aca257b4700160869?OpenDocument","Fresh","2025-09-12 10:46:12","South Gippsland Shire Council&nbsp","&nbsp","9 Smith StreetLeongatha, VIC   3953&nbsp","Private Bag 4Leongatha, VIC 3953&nbsp","0428 821 279&nbsp","[email&#160;protected]&nbsp",,,"Categories: screen, script, scripts, Section, see, Service, Services, Shire, size, Smith, South, src, static, Street, strong, style, superseded, supplierdetails","S"
"Southwest Traffic Control Pty","https://webapps.vicroads.vic.gov.au/vrne/prequal.nsf/b5fea222939e6f00ca25783e000334ef/610e3588c686857fca258053001302f9?OpenDocument","Fresh","2025-09-12 10:46:12","Southwest Traffic Control Pty&nbsp","&nbsp","129 Curdievale RoadTIMBOON  VIC   3268&nbsp","&quot;As Above&quot; &nbsp","0458 844191&nbsp","[email&#160;protected] &nbsp",,,"Categories: screen, script, scripts, Section, see, Service, Services, size, Southwest, src, static, strong, style, superseded, supplierdetails","S"
"Spiire Australia Pty Ltd","https://webapps.vicroads.vic.gov.au/vrne/prequal.nsf/b5fea222939e6f00ca25783e000334ef/e1a34d63113dd3ecca257c9b0006c007?OpenDocument","Fresh","2025-09-12 10:46:13","Spiire Australia Pty Ltd&nbsp","&nbsp","Level 6,  414 La Trobe StreetMELBOURNE, VIC    3000&nbsp","P O Box 16084 MELBOURNE, VIC  8007&nbsp","&nbsp","[email&#160;protected]&nbsp",,,"Categories: Safety, Scheme, screen, script, scripts, Section, Service, SH, Simple, size, Specialist, Specialists, Spiire, src, Stacey, static, Street, strong, Studies, Study, style, supplierdetails, Systems","S"
"Spotters Australia Pty Ltd","https://webapps.vicroads.vic.gov.au/vrne/prequal.nsf/b5fea222939e6f00ca25783e000334ef/5cfd042c9ac345bcca257c580005e20c?OpenDocument","Fresh","2025-09-12 10:46:14","Spotters Australia Pty Ltd&nbsp","&nbsp","255 Point Cook RoadPoint Cook, VIC   3030&nbsp","&quot;As Above&quot; &nbsp","0418 399 710&nbsp","[email&#160;protected]&nbsp",,,"Categories: screen, script, scripts, Section, see, Service, Services, size, Spotters, src, static, strong, style, superseded, supplierdetails","S"
"Spotto Consulting Pty Ltd","https://webapps.vicroads.vic.gov.au/vrne/prequal.nsf/b5fea222939e6f00ca25783e000334ef/ad2bee83edcd89eeca2585c300159ef6?OpenDocument","Fresh","2025-09-12 10:46:14","Spotto Consulting Pty Ltd&nbsp","&nbsp","9 Belah CourtTHURGOONA  NSW   &nbsp","&quot;As Above&quot; &nbsp","0455 11 77 82&nbsp","[email&#160;protected]&nbsp",,,"Categories: Safety, screen, script, scripts, Section, Service, Services, Signing, size, Specialists, Spotto, src, static, Steve, Strategies, strong, style, supplierdetails, Swann","S"
"SprayLine Road Services","https://webapps.vicroads.vic.gov.au/vrne/prequal.nsf/b5fea222939e6f00ca25783e000334ef/b4b1af2c1a928181ca256d0b00171ee8?OpenDocument","Fresh","2025-09-12 10:46:15","SprayLine Road Services&nbsp","&nbsp","26 Fowler RoadDANDENONG  VIC   3175&nbsp","&quot;As Above&quot;&nbsp","0418 504 376&nbsp","[email&#160;protected]&nbsp","Categories: Categories:, Categories:, Maintenance Bridges (M2-BW), Maintenance Pavements (M2-PW), Maintenance Roadsides (M2-RW), Maintenance Works-Minor (M1)","General Works-Minor (G1), Linemarking (G2-LM), Road Surfacing Sprayed Seal (G2-RSS)","Categories: B1, F050, M1, M2-BW, M2-PW, M2-RW, R2, screen, script, scripts, Seal, Section, Service, Services, size, Sprayed, SprayLine, src, State, static, strong, style, supplierdetails, Surfacing","S"
"SR Excavations Pty Ltd","https://webapps.vicroads.vic.gov.au/vrne/prequal.nsf/b5fea222939e6f00ca25783e000334ef/264ad95970a79eafca257ee600166734?OpenDocument","Fresh","2025-09-12 10:46:16","SR Excavations Pty Ltd&nbsp","&nbsp","5/24 -26 Boys Home RoadNEWHAVEN  VIC   3925&nbsp","&quot;As Above&quot; &nbsp","0429 598 819&nbsp","[email&#160;protected]&nbsp",,,"Categories: screen, script, scripts, Section, see, Service, Services, size, SR, src, static, strong, style, superseded, supplierdetails","S"
